{
  "$schema": "https://nvidia.github.io/agent-tool-schema/v1",
  "schema_version": "1.0.0",
  "tool": {
    "name": "NeMo Curator",
    "package": "nemo_curator",
    "version": "unknown",
    "description": "Scalable data curation library for training large language models",
    "install": "pip install nemo-curator"
  },
  "metadata": {
    "generated_at": "2026-02-03T15:19:56.255507+00:00",
    "generator": "generate_agent_tool_schema.py",
    "generator_version": "1.0.0"
  },
  "types": {
    "DocumentBatch": {
      "description": "Batch of text documents",
      "runtime_type": "nemo_curator.tasks.DocumentBatch",
      "data_format": "pd.DataFrame | pa.Table",
      "common_columns": [
        "text",
        "id",
        "url"
      ]
    },
    "VideoTask": {
      "description": "Video processing task",
      "runtime_type": "nemo_curator.tasks.video.VideoTask",
      "data_format": "Video object"
    },
    "ImageBatch": {
      "description": "Batch of images",
      "runtime_type": "nemo_curator.tasks.image.ImageBatch",
      "data_format": "list[ImageObject]"
    },
    "AudioBatch": {
      "description": "Batch of audio files",
      "runtime_type": "nemo_curator.tasks.audio.AudioBatch",
      "data_format": "dict | list[dict]"
    },
    "FileGroupTask": {
      "description": "Group of file paths",
      "runtime_type": "nemo_curator.tasks.FileGroupTask",
      "data_format": "list[str]"
    },
    "Task": {
      "description": "Generic task",
      "runtime_type": "nemo_curator.tasks.Task",
      "data_format": "varies"
    }
  },
  "operations": {
    "AddId": {
      "import": "from nemo_curator.stages.text.modules.add_id import AddId",
      "description": "The module responsible for adding unique IDs to each document record.",
      "category": [
        "text",
        "module"
      ],
      "input_type": "DocumentBatch",
      "output_type": "DocumentBatch",
      "resources": {
        "requires_gpu": false
      }
    },
    "AegisClassifier": {
      "import": "from nemo_curator.stages.text.classifiers.aegis import AegisClassifier",
      "description": "NVIDIA's AEGIS safety classifier is a LLM content safety model.",
      "category": [
        "text",
        "classifier",
        "ml"
      ],
      "input_type": "DocumentBatch",
      "output_type": "DocumentBatch",
      "resources": {
        "requires_gpu": true,
        "gpu_memory_gb": 16.0,
        "requires_credentials": [
          "HF_TOKEN"
        ]
      },
      "hints": {
        "purpose": "Detect harmful content",
        "output_values": [
          "safe",
          "O1",
          "O2",
          "O3",
          "O4",
          "O5",
          "O6",
          "O7",
          "O8",
          "O9",
          "O10",
          "O11",
          "O12",
          "O13"
        ],
        "when_to_use": "Safety filtering before release"
      }
    },
    "AegisModelStage": {
      "import": "from nemo_curator.stages.text.classifiers.aegis import AegisModelStage",
      "description": "See ModelStage for more information.",
      "category": [
        "text",
        "classifier",
        "ml"
      ],
      "input_type": "DocumentBatch",
      "output_type": "DocumentBatch",
      "parameters": {
        "model_identifier": {
          "type": "string"
        },
        "cache_dir": {
          "type": "string",
          "required": false
        },
        "hf_token": {
          "type": "string",
          "required": false
        },
        "label_field": {
          "type": "string",
          "default": "preds",
          "required": false
        },
        "score_field": {
          "type": "string",
          "default": "probs",
          "required": false
        },
        "model_inference_batch_size": {
          "type": "integer",
          "default": 256,
          "required": false
        },
        "has_seq_order": {
          "type": "boolean",
          "default": true,
          "required": false
        },
        "add_instruction_data_guard": {
          "type": "boolean",
          "default": false,
          "required": false
        },
        "autocast": {
          "type": "boolean",
          "default": true,
          "required": false
        }
      },
      "resources": {
        "requires_gpu": true,
        "gpu_memory_gb": 8.0
      }
    },
    "AlphaFilter": {
      "import": "from nemo_curator.stages.text.filters.code import AlphaFilter",
      "description": "This filter tries to identify files that have large tensors, or tables stored as raw text within code files.",
      "category": [
        "text",
        "filter"
      ],
      "input_type": "DocumentBatch",
      "output_type": "DocumentBatch",
      "parameters": {
        "min_alpha_ratio": {
          "type": "number",
          "default": 0.25,
          "required": false
        }
      },
      "resources": {
        "requires_gpu": false
      }
    },
    "ArxivDownloadExtractStage": {
      "import": "from nemo_curator.stages.text.download.arxiv.stage import ArxivDownloadExtractStage",
      "description": "Composite stage for downloading and processing Arxiv data.",
      "category": [
        "text",
        "download"
      ],
      "input_type": "DocumentBatch",
      "output_type": "DocumentBatch",
      "parameters": {
        "download_dir": {
          "type": "string",
          "default": "./arxiv_downloads",
          "required": false
        },
        "url_limit": {
          "type": "integer",
          "required": false
        },
        "record_limit": {
          "type": "integer",
          "required": false
        },
        "add_filename_column": {
          "type": "boolean | string",
          "default": true,
          "required": false
        },
        "log_frequency": {
          "type": "integer",
          "default": 1000,
          "required": false
        },
        "verbose": {
          "type": "boolean",
          "default": false,
          "required": false
        }
      },
      "resources": {
        "requires_gpu": false
      }
    },
    "AudioToDocumentStage": {
      "import": "from nemo_curator.stages.audio.io.convert import AudioToDocumentStage",
      "description": "Stage to conver DocumentObject to DocumentBatch",
      "category": [
        "audio",
        "io"
      ],
      "input_type": "AudioBatch",
      "output_type": "AudioBatch",
      "resources": {
        "requires_gpu": false
      }
    },
    "BoilerPlateStringFilter": {
      "import": "from nemo_curator.stages.text.filters.heuristic_filter import BoilerPlateStringFilter",
      "description": "If more than 40% of paragraphs contain boilerplate strings, then discard.",
      "category": [
        "text",
        "filter"
      ],
      "input_type": "DocumentBatch",
      "output_type": "DocumentBatch",
      "parameters": {
        "remove_if_at_top_or_bottom": {
          "type": "boolean",
          "default": true,
          "required": false
        },
        "max_boilerplate_string_ratio": {
          "type": "number",
          "default": 0.4,
          "required": false
        }
      },
      "resources": {
        "requires_gpu": false
      }
    },
    "BoilerPlateStringModifier": {
      "import": "from nemo_curator.stages.text.modifiers.c4 import BoilerPlateStringModifier",
      "description": "If the sentence contains any of the boilerplate strings then discard.",
      "category": [
        "text",
        "modifier"
      ],
      "input_type": "DocumentBatch",
      "output_type": "DocumentBatch",
      "parameters": {
        "remove_if_at_top_or_bottom": {
          "type": "boolean",
          "default": true,
          "required": false
        }
      },
      "resources": {
        "requires_gpu": false
      }
    },
    "BucketsToEdgesStage": {
      "import": "from nemo_curator.stages.deduplication.fuzzy.buckets_to_edges import BucketsToEdgesStage",
      "description": "Stage that takes in a file consiting of LSH bucket ids and document ids belonging to the bucket and outputs a file consisting of edges between documents with the same bucket id.",
      "category": [
        "deduplication",
        "fuzzy"
      ],
      "input_type": "Task",
      "output_type": "Task",
      "parameters": {
        "output_path": {
          "type": "string"
        },
        "document_id_field": {
          "type": "string",
          "default": "<CURATOR_DEDUP_ID_STR>",
          "required": false
        },
        "read_kwargs": {
          "type": "object",
          "required": false
        },
        "write_kwargs": {
          "type": "object",
          "required": false
        }
      },
      "resources": {
        "requires_gpu": false
      }
    },
    "BulletsFilter": {
      "import": "from nemo_curator.stages.text.filters.heuristic_filter import BulletsFilter",
      "description": "If more than 90% of the lines start with a bullet, then discard.",
      "category": [
        "text",
        "filter"
      ],
      "input_type": "DocumentBatch",
      "output_type": "DocumentBatch",
      "parameters": {
        "max_bullet_lines_ratio": {
          "type": "number",
          "default": 0.9,
          "required": false
        }
      },
      "resources": {
        "requires_gpu": false
      }
    },
    "CaptionEnhancementStage": {
      "import": "from nemo_curator.stages.video.caption.caption_enhancement import CaptionEnhancementStage",
      "description": "Stage that enhances video captions using language models.",
      "category": [
        "video",
        "captioning",
        "ml"
      ],
      "input_type": "VideoTask",
      "output_type": "VideoTask",
      "resources": {
        "requires_gpu": true,
        "gpu_memory_gb": 16.0
      }
    },
    "CaptionGenerationStage": {
      "import": "from nemo_curator.stages.video.caption.caption_generation import CaptionGenerationStage",